{
  "_data_dictionary": {
    "HEADER": "Requirement Intelligence Platform (RIP) - VB6 Edition"
  },
  "modernization_manifesto": {
    "Coding Standards": "Target TypeScript/React for UI components and Java Spring Boot for backend services.",
    "Database Strategy": "Replace VB6 ADO/DAO/RDO recordsets and embedded SQL with RESTful API endpoints and JPA/Hibernate repositories.",
    "Architecture": "Decouple VB6 Forms, standard/class modules, global state, and COM/ActiveX (OCX) components into stateless, cloud-native microservices.",
    "Security": "Enforce JWT-based authentication and Role-Based Access Control (RBAC) for all newly generated API contracts."
  },
  "target_architecture": {
    "_note": "OPTIONAL, source-language-independent target contract for Stage 6. Same schema for VB6/PowerBuilder/COBOL/future stacks — describes the NEW system only. Any field left blank is DECIDED by the generator from a grounded default (target_stack + modernization_manifesto + best practice) and recorded in the decision ledger — not raised as a blocking question. Values below are a worked example for this VB6 project's React + Spring Boot + PostgreSQL target; edit to match your standards.",
    "topology": "modular-monolith",
    "system": {
      "_note": "Tier-B system/platform decisions (v2 spec). Monolith-first for autonomy: one deployable, schema-per-module ownership, in-process module calls, with a documented services-extraction seam.",
      "data_ownership": "schema-per-module (single PostgreSQL; no cross-module table access — calls go through module interfaces)",
      "identity": {
        "issuer": "in-app Auth module (login/refresh/logout) issuing JWTs",
        "token": "JWT (access + refresh)",
        "refresh": true,
        "rbac_source": "legacy System Administration module (users, roles, permissions)"
      },
      "config_secrets": {
        "config": "Spring profiles + externalized config",
        "secrets": "AWS Secrets Manager"
      },
      "deployment": {
        "packaging": "single Spring Boot container (one deployable) + static React bundle",
        "ci": "build -> test -> containerize pipeline",
        "iac": "AWS ECS service + RDS (PostgreSQL) baseline",
        "environments": [
          "dev",
          "stage",
          "prod"
        ]
      },
      "data_migration": {
        "approach": "one-time ETL from legacy DB to PostgreSQL with per-entity field mapping",
        "cutover": "freeze-and-migrate with validation reconciliation (HIGH-RISK: human-gated)"
      },
      "observability": {
        "logging": "SLF4J structured JSON + correlation id",
        "metrics": "Micrometer -> CloudWatch",
        "tracing": "in-process (single deployable); add distributed tracing only if services are extracted",
        "health": true
      },
      "testing": {
        "unit": "JUnit 5",
        "integration": "Testcontainers (PostgreSQL)",
        "acceptance_gate": "app compiles, boots green, smoke + API/contract tests pass"
      },
      "concurrency": "optimistic-locking (JPA @Version on editable entities)",
      "audit": true
    },
    "build": "Maven (backend) + pnpm (frontend)",
    "runtime": "JDK 21 / Node 20",
    "tech_allowlist": [
      "Java 21",
      "Spring Boot 3",
      "Spring Web",
      "Spring Data JPA",
      "Hibernate",
      "Spring Security (JWT)",
      "Spring Batch",
      "Bean Validation",
      "MapStruct",
      "Flyway",
      "React 18",
      "TypeScript 5",
      "Vite",
      "Axios",
      "PostgreSQL 16",
      "Maven",
      "pnpm",
      "AWS ECS",
      "AWS RDS",
      "AWS API Gateway",
      "AWS EventBridge",
      "AWS Secrets Manager"
    ],
    "architecture_style": "microservices",
    "layers": [
      {
        "id": "ARC-LYR-001",
        "name": "Presentation",
        "responsibility": "React/TypeScript UI; no business logic.",
        "allowed_dependencies": [
          "ARC-LYR-002"
        ]
      },
      {
        "id": "ARC-LYR-002",
        "name": "API",
        "responsibility": "REST controllers, request/response DTOs, JWT/RBAC enforcement.",
        "allowed_dependencies": [
          "ARC-LYR-003"
        ]
      },
      {
        "id": "ARC-LYR-003",
        "name": "Application",
        "responsibility": "Use-case services, transaction boundaries, orchestration.",
        "allowed_dependencies": [
          "ARC-LYR-004",
          "ARC-LYR-005"
        ]
      },
      {
        "id": "ARC-LYR-004",
        "name": "Domain",
        "responsibility": "Entities, value objects, domain rules (framework-free).",
        "allowed_dependencies": []
      },
      {
        "id": "ARC-LYR-005",
        "name": "Infrastructure",
        "responsibility": "JPA repositories, external adapters, messaging.",
        "allowed_dependencies": [
          "ARC-LYR-004"
        ]
      }
    ],
    "component_types": [
      {
        "name": "Controller",
        "layer": "ARC-LYR-002",
        "folder": "src/main/java/**/web",
        "naming": "<Feature>Controller",
        "template_ref": "controller.tmpl"
      },
      {
        "name": "DTO",
        "layer": "ARC-LYR-002",
        "folder": "src/main/java/**/web/dto",
        "naming": "<Feature>Request|<Feature>Response",
        "template_ref": "dto.tmpl"
      },
      {
        "name": "Service",
        "layer": "ARC-LYR-003",
        "folder": "src/main/java/**/service",
        "naming": "<Feature>Service",
        "template_ref": "service.tmpl"
      },
      {
        "name": "Entity",
        "layer": "ARC-LYR-004",
        "folder": "src/main/java/**/domain",
        "naming": "<Entity>",
        "template_ref": "entity.tmpl"
      },
      {
        "name": "Repository",
        "layer": "ARC-LYR-005",
        "folder": "src/main/java/**/repository",
        "naming": "<Entity>Repository",
        "template_ref": "repository.tmpl"
      },
      {
        "name": "Mapper",
        "layer": "ARC-LYR-003",
        "folder": "src/main/java/**/mapper",
        "naming": "<Entity>Mapper",
        "template_ref": "mapper.tmpl"
      },
      {
        "name": "ReactComponent",
        "layer": "ARC-LYR-001",
        "folder": "web/src/features/<feature>",
        "naming": "<Feature>.tsx",
        "template_ref": "react_component.tmpl"
      },
      {
        "name": "ApiClient",
        "layer": "ARC-LYR-001",
        "folder": "web/src/api",
        "naming": "<feature>Api.ts",
        "template_ref": "api_client.tmpl"
      }
    ],
    "naming_conventions": {
      "java_package_root": "com.smias",
      "rest_path": "/api/v1/<resource>",
      "table": "snake_case",
      "class": "PascalCase",
      "react_component": "PascalCase"
    },
    "folder_structure": {
      "root": "one Maven module (backend) + one Vite app (web) per microservice",
      "mapping_rules": [
        "One microservice per bounded context (module) from module_manifest.",
        "Shared/Infrastructure module -> a common library, not a service.",
        "Feature code is placed by component_type folder rules above."
      ]
    },
    "cross_cutting": [
      {
        "concern": "security",
        "approach": "Spring Security with JWT bearer tokens; RBAC via method-level @PreAuthorize on controllers."
      },
      {
        "concern": "logging",
        "approach": "SLF4J + structured JSON logs; correlation id per request."
      },
      {
        "concern": "error_handling",
        "approach": "@ControllerAdvice returning RFC 7807 problem+json."
      },
      {
        "concern": "transactions",
        "approach": "Spring @Transactional at the Application-service boundary."
      },
      {
        "concern": "configuration",
        "approach": "Spring profiles + externalized config; secrets from AWS Secrets Manager."
      },
      {
        "concern": "validation",
        "approach": "Bean Validation on request DTOs."
      }
    ],
    "nfrs": [
      {
        "category": "performance",
        "target": "p95 API latency < 300ms",
        "architectural_response": "stateless services, connection pooling, read models where needed."
      },
      {
        "category": "availability",
        "target": "99.9%",
        "architectural_response": "multi-AZ ECS, health checks, graceful shutdown."
      },
      {
        "category": "security",
        "target": "no unauthenticated write paths",
        "architectural_response": "JWT/RBAC enforced at API layer."
      }
    ],
    "batch_strategy": {
      "technology": "Spring Batch",
      "scheduling": "cron via scheduler (e.g. EventBridge) triggering batch jobs",
      "chunking": "chunk-oriented processing for large runs",
      "restart_policy": "restartable jobs with checkpointing",
      "_note": "Light for this UI-centric VB6 system (a few batch modules); COBOL projects populate this more heavily. Same keys either way."
    },
    "data": {
      "persistence": "Spring Data JPA / Hibernate",
      "migrations": "Flyway",
      "transaction_boundaries": "per Application-service use case"
    }
  },
  "project": {
    "id": "vb6_smias",
    "name": "A Complete Inventory and Account Receivable System",
    "client": "Internal Transformation Team",
    "source_paradigm": "vb6",
    "plugins": [
      "vb6"
    ],
    "source_path": "input/smias_flat",
    "target_stack": {
      "frontend": "React/TypeScript",
      "backend": "Java Spring Boot",
      "infrastructure": "AWS Cloud",
      "architecture": "Microservices",
      "database": "PostgreSQL"
    }
  },
  "llm": {
    "_note": "LLM provider configuration for the RIP pipeline. To switch providers, change 'active_provider' to one of: openai | anthropic | gemini | deepseek.",
    "active_provider": "deepseek",
    "stream_providers": [
      "anthropic"
    ],
    "timeout_fallback": {
      "enabled": true,